<!ELEMENT onlineStore (product+)>
<!ELEMENT product (name, category, price, stock)>
<!ATTLIST product
    id CDATA #REQUIRED>
<!ELEMENT name (#PCDATA)>
<!ELEMENT category (#PCDATA)>
<!ELEMENT price (#PCDATA)>
<!ATTLIST price
    currency (USD) #REQUIRED>
<!ELEMENT stock (#PCDATA)>